post_id|subject|content|unique_views|good_question|visibility|i_answer|s_answer|num_followups
lfzyl8utwo74m0|Size_t|Why are we returning size_t for the height and size function instead of int like we did for linked lists?|101|0|active|It doesn't really make sense for a height/size of something to be negative, so we return a size_t, which is always non-negative, to best represent the value.. You should always be extra careful to not assign a negative value to a size_t, otherwise it will overflow and return an extremely large value. It also means that when you see a size that is unreasonably large, you should check if you've accidentally let it be negative.||0
lfzyg2h3yrb4dk|Key_compare - error: no match for call to|"How are you meant to use the ""Key_compare"" functor?. . Right now, if I return ""true"" or ""false"" from my operator() implementation for PairLess in Map.h, the compile check runs just fine. However, the moment I try to actually compare the two values (such as ""return Key_compare(lhs.first, rhs.first);""), the compile check fails with a message like the following:. . In file included from Map_compile_check.cpp:5:. Map.h: In instantiation of ‘bool Map<Key_type, Value_type, Key_compare>::PairLess::operator()(const Pair_type&, const Pair_type&) const [with Key_type = std::__cxx11::basic_string<char>; Value_type = int; Key_compare = std::less<std::__cxx11::basic_string<char> >; Map<Key_type, Value_type, Key_compare>::Pair_type = std::pair<std::__cxx11::basic_string<char>, int>]’:. BinarySearchTree.h:653:13:   required from ‘static BinarySearchTree<T, Compare>::Node* BinarySearchTree<T, Compare>::min_greater_than_impl(BinarySearchTree<T, Compare>::Node*, const T&, Compare) [with T = std::pair<std::__cxx11::basic_string<char>, int>; Compare = Map<std::__cxx11::basic_string<char>, int>::PairLess]’. BinarySearchTree.h:200:45:   required from ‘BinarySearchTree<T, Compare>::Iterator& BinarySearchTree<T, Compare>::Iterator::operator++() [with T = std::pair<std::__cxx11::basic_string<char>, int>; Compare = Map<std::__cxx11::basic_string<char>, int>::PairLess]’. Map_compile_check.cpp:98:7:   required from here. Map.h:44:18: error: no matching function for call to ‘std::less<std::__cxx11::basic_string<char> >::less(const std::__cxx11::basic_string<char>&, const std::__cxx11::basic_string<char>&)’.    44 |           return Key_compare(lhs.first, rhs.first);.       |                  ^~~~~~~~~~~~~~~~~~~~~~~~~~~~~~~~~. In file included from /usr/include/c++/11/string:48,.                  from Map_compile_check.cpp:3:. /usr/include/c++/11/bits/stl_function.h:395:12: note: candidate: ‘constexpr std::less<std::__cxx11::basic_string<char> >::less()’.   395 |     struct less : public binary_function<_Tp, _Tp, bool>.       |            ^~~~. /usr/include/c++/11/bits/stl_function.h:395:12: note:   candidate expects 0 arguments, 2 provided. /usr/include/c++/11/bits/stl_function.h:395:12: note: candidate: ‘constexpr std::less<std::__cxx11::basic_string<char> >::less(const std::less<std::__cxx11::basic_string<char> >&)’. /usr/include/c++/11/bits/stl_function.h:395:12: note:   candidate expects 1 argument, 2 provided. /usr/include/c++/11/bits/stl_function.h:395:12: note: candidate: ‘constexpr std::less<std::__cxx11::basic_string<char> >::less(std::less<std::__cxx11::basic_string<char> >&&)’. /usr/include/c++/11/bits/stl_function.h:395:12: note:   candidate expects 1 argument, 2 provided. In file included from Map_compile_check.cpp:5:. Map.h: In instantiation of ‘bool Map<Key_type, Value_type, Key_compare>::PairLess::operator()(const Pair_type&, const Pair_type&) const [with Key_type = Duck; Value_type = std::__cxx11::basic_string<char>; Key_compare = DuckWealthLess; Map<Key_type, Value_type, Key_compare>::Pair_type = std::pair<Duck, std::__cxx11::basic_string<char> >]’:. BinarySearchTree.h:653:13:   required from ‘static BinarySearchTree<T, Compare>::Node* BinarySearchTree<T, Compare>::min_greater_than_impl(BinarySearchTree<T, Compare>::Node*, const T&, Compare) [with T = std::pair<Duck, std::__cxx11::basic_string<char> >; Compare = Map<Duck, std::__cxx11::basic_string<char>, DuckWealthLess>::PairLess]’. BinarySearchTree.h:200:45:   required from ‘BinarySearchTree<T, Compare>::Iterator& BinarySearchTree<T, Compare>::Iterator::operator++() [with T = std::pair<Duck, std::__cxx11::basic_string<char> >; Compare = Map<Duck, std::__cxx11::basic_string<char>, DuckWealthLess>::PairLess]’. Map_compile_check.cpp:99:7:   required from here. Map.h:44:18: error: no matching function for call to ‘DuckWealthLess::DuckWealthLess(const Duck&, const Duck&)’.    44 |           return Key_compare(lhs.first, rhs.first);.       |                  ^~~~~~~~~~~~~~~~~~~~~~~~~~~~~~~~~. Map_compile_check.cpp:20:7: note: candidate: ‘constexpr DuckWealthLess::DuckWealthLess()’.    20 | class DuckWealthLess {.       |       ^~~~~~~~~~~~~~. Map_compile_check.cpp:20:7: note:   candidate expects 0 arguments, 2 provided. Map_compile_check.cpp:20:7: note: candidate: ‘constexpr DuckWealthLess::DuckWealthLess(const DuckWealthLess&)’. Map_compile_check.cpp:20:7: note:   candidate expects 1 argument, 2 provided. Map_compile_check.cpp:20:7: note: candidate: ‘constexpr DuckWealthLess::DuckWealthLess(DuckWealthLess&&)’. Map_compile_check.cpp:20:7: note:   candidate expects 1 argument, 2 provided. make: *** [Makefile:43: Map_compile_check.exe] Error 1. This error makes no sense, as all of the ""no matching function for call to"" errors HAVE matching function calls (""DuckWealthLess::DuckWealthLess(const Duck&, const Duck&)"", for example, is defined exactly as it says it needs to be inside of the compile check function; the class is the same, the arguments are the same, all of it). I don't understand how the ""Key_compare"" functor is meant to be used.. . Any help is appreciated."|88|0|active|Answering my own question here, but apparently you need to use the following instead:. . Key_compare()(lhs.first, rhs.first);. ||0
lfzwoaq5a375wq|For each label W and word C, the number of posts with label  C that contain  W.|"In this information we can have some keys that their value is 0 right? And we would have a total of |C| * |W| keys?"|59|0|active|If you are asking about the number of keys in the map where you use to store such information, yes, as you need to iterate through every unique combination of label $$C$$ and word $$w$$.||0
lfzw0wn1t591ug|Invariants|For the insert function, we need to implement this keeping in mind the sorting invariant. Do we also need to keep in mind the duplicates invariant when implementing or do we just assume that no duplicate values will be inserted. |96|0|active|The requires clause ensures that no duplicates will be added to the tree. You don't need to verify this yourself :)||0
lfzvmngxc47xt|Project 5|Hello, I was wondering if there were any big changes to project 5 for this semester compared to fall 22 semester. I'm unfortunately retaking the class and was wondering.|4|0|private|||0
lfzuc5ku8371ao|Confusion about root node|I am a bit confused about the root node. When we insert a new element into the tree, it looks like the root node is set to point at that element. So am I correct in saying that the root changes after each insertion, or am I missing something? Thanks!. . . . I am just confused since size() starts from the root, so when I insert an element, the root changes to that element and the size is always stuck at 1. |101|0|active|"Your implementation of ""insert_impl"" should return the root node, with all of its leaves updated to point to their proper children (including the newly inserted child). If your size is always 1 after using the included ""insert"" method, there's something wrong with your implementation of ""insert_impl""."||1
lfzrz9sk2rq51f|min_greater_than_impl|I'm a bit confused about how to approach the algorithm for min_greater_than_impl with only one recursive call. Does anyone have any pointers in the right direction?|97|0|active|You'll actually need two recursive calls (only one of which will be called for each recursion, however). One goes down the left path, and the other goes down the right path. Think about when you would need to go down one path or the other, based on the sorting invariant.Once you've found the correct Node, it should be returned all the way back up the chain. You just need to determine when you've found the right Node (think about the difference between when you go left and find a nullptr, vs. when you go right and encounter a nullptr; in one of these cases, you've found the correct Node that should be returned all the way back up, and in the other you're looking at a value that's too large).It's also worth noting that you should return a nullptr immediately if the node you are looking at is null.||0
lfzrkvsicks15x|Project 5 lecture knowledge|Do we know enough to do all of project 5? And if not, what parts of the project can we do right now and what date/lecture will we know enough to complete the whole project? I want to start on this early ASAP, but I understand that it might be like P4 where we had to wait for the linked lists and iterator lecture.|121|4|active|You can always read the lecture notes for some pointers on a lot of the project-related concepts (usually only takes ~15 minutes or so, which is great if you're trying to get a head start). The lecture notes sometimes implement the functions you need for you, which is a nice bonus.I can't speak on the whole project, but for BST and its tests you really only need to understand recursion.||0
lfzrgibl4kx690|less function call|. Currently, I'm calling my less function like this in my BinarySearchTree.h and its giving me compile errors on the autograder, I went to the website of the previous post about calling the less function and followed that format and it gave me errors. The bellow writing would return true if thing1 were less than thing2. I'm just confused on how to call less in my program, any help would be appreciated.. . less<T>{}(thing1, thing2). |89|0|active|"The format ""less(thing1, thing2)"" should work to test if thing1 is less than thing2. "||1
lfzl9yce8137oa|project 5 changes|I was trying to get an idea of time, and was just wondering if project 5 had changed much from last semester?|146|0|active|The project is the same!||0
lfzl5z0t3h47m2|insert_impl|Can we assume that the inserted element into the tree is not going to be contained in the root node. Or do we have to account for insertion of the same item into the tree that is contained in the root node.|123|0|active|I recommend you read over the invariants for BST :)||0
lfyp9mlolvy4tu|Less Comparator|Hello, I wasn't sure about the specific syntax for using the less comparator to compare two values.|7|0|private|The comparator takes in two objects of the same type and perform comparison based on the `||0
lfyok4w0hccbj|In what format do we need to the read the csv file?|"I am confused because in train_small.csv it is in the format ""n,unique_views,tag,content"", but in the other ones it is in ""tag,content"""|110|1|active|You only need the tag and content columns. You can use the provided csvstream.h library (https://github.com/awdeorio/csvstream) which allows you to easily read in specific columns and their values||0
lfxggypk3qv5f5|how does copy_nodes_impl work?|. For copy_nodes_impl(), do we create a new node that has the same structure and we connect the top node to the new node?. |154|0|active|I believe it's creating a new node structure, that is identical, but they are not connected in any way. The function is used in the copy constructor and = operator.||2
lfx3jm3elar17|Error in Value_type() in map.h|Can someone explain to me why do I have this error?. .  |121|0|active|You might want to construct your pair using this notation: `{k, Value_type()}` or use `std::make_pair`||1
lfx21sbaldj7m0|height_impl - do we need to make a max function?|if so, how do we go about doing it?|146|0|active|"If by max function, you mean a function that returns the datum of the Node with the largest value, then this doesn't seem helpful for the height_impl function.. Side note: if you did want to create such a max function, we would just have to find the ""right-most"" child. We can do this because of the sorting invariant.. . If by max function you mean a function that, given two integers (eg. heights), returns the larger integer, then this seems like something you may need. You could implement such n algorithm yourself using if statements or use std::max"||0
lfwuob54upc19j|Compare Less Operator|Hi,. Is there a simple example of how to use the Compare std::less operator in bst.h with static types such as ints or strings so I know how to implement it correctly? Thank you|193|2|active|I found this website quite useful:. https://www.fluentcpp.com/2019/10/29/stdless-and-its-modern-evolution/||1
lfwl029xx6c30g|P5 Question|Which file should I begin with? I am so lost on where to start :/|247|0|active|I would do BST.h and then write your own BST_tests to heavily debug it (because the next part depends upon it).. I would then do map.h and then finally the driver.. Although the driver you will use the STL library.||1
lfua1it1cbk39i|Fix for this error|I keep getting this error  when I test my api. I was wondering if anyone had a fix for this problem?. . |180|1|active|||2
lfslb63wkk5235|project 5 release date|When will the autograder for project 5 be released?|188|0|active|Likely later this week or early next week after the end of P4.||0
