post_id|subject|content|unique_views|good_question|visibility|i_answer|s_answer|num_followups
l7pkewu6tuc28r|Autograder Error|image_2022-09-05_221617586.pngimage_2022-09-05_221642169.pngI am getting an error in autograder even though I have the project uid comment on top of my files. Does anybody have any idea why this error is occurring?|155|0|active|The project UID in main.cpp doesn't match the one that it's expecting.||1
l7pivtzmk8175z|Stdev function keeps returning 0|I used the stdev formula listed on the wikipedia page, and I am using a for loop to do the summation for the formula. It seems to be summing correctly (I used cout to check), but somehow between that loop and the actual equation code it is getting set equal to 0. I was wondering if anyone else has had a similar problem?|175|0|active|Double check how you are calculating the standard deviation. I'd recommend breaking up your calculation into smaller components and checking using your debugger/cout if these components are the expected. . . Hint: There is an issue with conversion to a double! ||1
l7pgu0phosq32z|4 doubts regarding stats, stats_tests|"I just wanted clarity on a few points:. . 1. Is it okay to use sort() liberally for stats.cpp functions?. 2. The stats functions start off with assert(false) statement inside them. Once we are done writing the body of the method, we remove this statement. Correct?. 3. Is it okay to import <iostream> into stats.cpp? It wasn't imported by default.. 4. Can our stats_tests methods print output (""median works"", etc). . Thank you."|108|0|active|"Yes!Yes!Yes - the list of libraries you are allowed to import is listed here and will generally be listed for each projectYes - from Testing: ""You may print as much output as you like"". I expect other students may have similar questions and may benefit from seeing your post. If you don't mind, please mark you post as ""Public"" (you can always mark yourself as anonymous if you prefer)."||0
l7pgr2phyrl7an|ExceptionAbortion has occured|Hi! . . Follow up on @165:. . I don´t have any assertions anymore and I still get this error message. It is still at the same spot. I don´t understand what the Terminal is saying either. Does anyone has a suggestion? I uploaded my most recent files to autograder.. . . . . |128|0|active|"Very likely this exception message came from your old execution. This happened to me when the projects become large that the IDEs/editors just do not catch up with the latest code I modified. Yes, rebuild, recompile, sometimes close and reopen your visual debugger should help it to recognize the new code. However, autograder should not have the ""cache"" of your old code and claim the assertion error here.. . Note: We recommend students add their uniqnames on Piazza username, so we can take a look at your code on autograder given your unqinames."||3
l7pgf83w5om67h|Accessing elements of vector pairs in summarize()|In summarize() i created vector pairs with {value, frequency} and I want a way to access and check the specific value in each pair. When I look up online how to do this everything says to use vector_pair_name.first (to access value for example) but this doesn't work in vs code. What is the proper syntax to access individual elements of vector pairs?. . Thank you. |154|0|active|Be careful to note the difference between a vector of length 2 and a pair (std::pair). If you are working with a 2D vector where each of the inner vectors has a length of two, the student's answer would be correct that the proper syntax would be vec[<row>][0] for value and vec[<row>][1] for frequency in your example.||1
l7pbzcwgqa55zv|Question about how sort works during testing|I've been working through the project for the last 2 days and I'm almost ready for my first submission, but I was wondering about how the sort function affects how I've been testing.. I call extract(v) and sort(v) in main.cpp before any of my other function, and I've been writing my functions in stats.cpp under the assumptions that the vector input will be sorted.. I've been writing the testcases using vectors that are also sorted in ascending order like how the sort function works. . I'm wondering if this is a bad and I shouldn't expect my column to be sorted even though I call sort(). EX like how I am working on min/max. . Am I gonna be screwed if I work assuming my min will be in front and my max will be at the back?|9|0|private|Check out the REQUIRES clause for the median function(and other functions), in stats.h! Does it say the input vector will be sorted when passed in? If not, then we shouldn't assume the input vector will be sorted.||0
l7pbgqjun0h2pm|Sort function gives an error message|Hello! I’m getting this error when using the sort function (from p1 library):. . . Undefined symbols for architecture arm64:. “sort(std::__1::vector<double, std::__1::allocator >&)”, referenced from:. _main in stats_public_test-5efac1.o. ld: symbol(s) not found for architecture arm64. clang: error: linker command failed with exit code 1 (use -v to see invocation). . This is after including the header and running the whole vector through the function (just did sort(data) to test the public test vector). Any help would be appreciated!. |229|0|active|"My guess is that when compiling, ""p1_library.cpp"" is not properly being passed to g++. To understand why, I would need to see more about your setup.. . To start with, if you type ""make"" in your terminal, do you get the same error?"||1
l7paeruj1ny4hb|summarize function|Hello! I'm a bit confused on where to start with the summarize function. Any chance I could get a tip for a starting point. |12|0|private|Lot of good examples on Piazza. Think about why we give you the sort() function.||1
l7pa07326413g|Edge case behavior for min, max|If there isn't one min/max in the array, what should be returned from either function?|140|0|active|Note as well for any non-empty vector, there is only one min and one max.||0
l7p9z9tfnk0q7|Undefined Behavior Checks|So, I have passed my public tests but my public tests for undefined behaviour checks is failing. The 100th percentile just does not print. What should I do about that?|172|0|active|This sounds similar to @187 which @148 helps resolve||0
l7p897oom9jg7|Test Functions|I'm a little confused about what to do with test functions and what data we use for them. I understand they are our way to make sure our functions are working, but I'm not too sure how to code them. I know that we are suppose to use the assert() function to make sure everything is running properly. I guess what I'm exactly confused about is what kind of data should we use? Do we use the data from main_test_data.tsv? Do we use the data from How Couples Meet and Stay Together study? Can we make our own data just like how in stats_test.cpp gives us a function where they create a vector and push back data into and use it as their test data? Is there a certain amount of test that can be utilized in one test function? Does it even matter what kind of data we use?. . I apologize if this is a redundant question. First time taking a EECS class at UOM and really scared of the formatting and grading systems. I hope you understand|161|0|active|The students' answer has a lot of good points. You can use whatever data you'd like to test your functions, just make sure you know what the correct output should be (or can easily find it)! Like the students' answer says, be intentional about what data you are using to try and find bugs.. . You'll see 'edge cases' talked about a lot. These can mean literal edges, like a function that takes in the numbers 1-10 (inclusive) can be tested with 1 and 10 as inputs. Edge cases can also be weird sets of data that you wouldn't always see, like small sets or sets of all the same number. . . Feel free to check out other piazza posts about test cases, the test writing process, and other bugs that students have run into as well! If you search 'test' in the search bar you will find a lot of posts.||0
l7p7d28ose465c|Trying to print 2d vector element with colon in middle.|resolved|84|0|active|You can stack “<<“ and it will concatenate. For example, “cout << a << “ - “ << b << endl;And this will print “[a] - [b]”. Make sure to put anything that isn’t a variable in quotes so that the compiler knows to treat it as text.||0
l7p75je7eht33q|Style Check with Comments|"Will single-line comments affect the style checks on your code when you submit the files to the autograder? (e.x.: cout << ""Hello World!"" << endl;           //This is a comment)"|120|0|active|"From https://eecs280staff.github.io/p1-stats/style_guide.html#comments: ""Comments go on their own line(s) unless they are extremely short."" Not sure if it'll affect the autograder but it's probably good convention."||0
l7p6yo0a1ue1k4|Error with summarize()|Could anyone explain this error or a way to go about fixing it?  |171|0|active|"Passing by const reference is valid. In this case, you avoid making copies of the original object, and ""const"" forbids you to make changes to the original object. Note that sometimes we pass by reference not because we want to modify the object, but because the object is too big and it costs a lot to make another copy -- We would save some space by avoiding making a copy."||1
l7p5uj5oxni19r|Mode Function|I'm not sure how to proceed with my mode function. Specifically, I don't know how to make tempocc record a different number than what is the first number in the vector.. modefunc.png|12|0|private|The first thing I notice is that tempocc is declared inside the loop, so it gets reset to 1 on every loop iteration. Same goes for the other two variables. To get a better idea of how these variables should be interacted with, it'd be better if you came to office hours||0
l7p5kkl0qzd89|Help with stdev tests|When I run my tests in my compiler it works fine and the asserts pass, when I submitted to the autograder I got this result:|134|0|active|I had this same issue. Make sure to #include <cmath>||0
l7p46agpda460t|A few questions on the project:|1. I'm not really sure how to go about my summarize function. My idea was to create an ifstream using the filename and store it into a vector of doubles; would that work? And if so would I just do fin >> v?. 2. I'm pretty lost on how to print out all the data like that. Would it involve storing all of the information into a vector of vectors prior to the main function or within the main function? Also, how would I go about storing all that data into a vector of vectors?. 3.  I'm confused about the median function: how would it differ from the mean?. Thank you.|217|0|active|"Make sure to read the provided code in ""p1_library.h"". There is some code in there that will make reading files much easier.Are you still talking about ""summarize""? That function isn't printing anything, just returning a vector of vectors. The main function should call several different functions and print out the results in a specific way.Consider the vector {1,3,100}. The median is 3 (middle value), but the mean is 33.5 ((1+3+100)/3).. . Great questions! I expect other students have similar ones. If your comfortable, please mark your question as ""public"" so other students can benefit from seeing the answer. (You can mark your question as ""anonymous"" if you'd prefer)."||0
l7p3ke0nh4a2ys|&#34;No such file or directory&#34;|"My terminal keeps saying ""no such file or directory"" so I can't compile anything using terminal. It says this when I try to use the clean command as well. How do I fix this? FBA9001E-EC39-4C2F-9105-96BC37DE60E6.jpeg"|84|0|active|I think you have to be in the directory with the specified files when you run the command. Use the change directory command (cd) to access the folder with your downloaded files, and try to run the command again ||1
l7p2jd07fzg6ci|style checks and mutation tests|Are there style checks or mutation tests on project 1? If so, do we get to see them?|106|0|active|Style checks, no mutation tests for p1.https://eecs280staff.github.io/p1-stats/setup_style.html||0
l7p14izmco967z|Question about project 1 tests|"Hi, The instructions say:""Each function in stats.cpp must have at least one corresponding test function in stats_tests.cpp."". For my tests, I only have 3 functions (for three different data sets), but each function calls every function in stats_tests.cpp. Is this ok, or am I supposed to have several separate test functions for every stats function?. Also, I was wondering how the tests we write are graded, as the autograder doesn't cover that. Are they just graded on completion and then the correctness of our code is evaluated by public and private tests, or do our tests get evaluated separately as well?"|121|0|active|"This isn't something we enforce with grading, but I would recommend having separate tests for each function. With your organization, if there is something wrong with, say, ""sum"", and everything else is fine, you may fail every test (which isn't very informative). If you separate them by function, it should be more immediately clear where the problem is because you only fail the tests that call ""sum"".. . But as long as you submit some test for the project that passes on a correct implementation, you will get credit for P1. The later projects will have more stringent requirements that we will discuss later."||0
l7p0tk821pi7jj|Behavior of tsv parsing function with missing values|How does the helper function handle missing values? Do I need to be concerned about missing values in my input vectors in stats.cpp?|83|0|active|Don’t worry about misformatted input. Expect the helped function to work fine. ||0
l7owbk83gdr1ez|make: *** [Makefile:9 test] error 1|. I get an error message when I tried to run make test on CAEN. The error message is shown in the summary also the screenshot. However, it doesn't seem like a big issue since all my programs run smoothly and seemly generated the desired output. How do I resolve this error?|116|0|active|It seems the output doesn't actually match: file name vs filename, coulumn vs column, etc. That's most likely why the command is failing.||0
l7otadcw3fh3t4|Autograder private tests|I submitted my files on autograder and somehow for the stats private tests section it only passed the compile test and all other tests are grayed out. how do i fix this?|108|0|active|Students are not allowed to see the private tests until after the project deadline. Those are meant to be hidden from students.||2
l7of35qeg225qd|Can&#39;t extract the whole column?|Something a little strange is happening for me. So most of my functions are running okay but a few were just slightly off. I tried checking what was wrong and found that for some reason extract_column isn't quite giving me all of the data. The very last row of data is just not there? Summarize just entirely doesn't show it so I tried just running extract_column and then printing out the data using a for loop. Ended up the same. . . My little test:. . . vector<double> data;.   data = extract_column(filename,columnName);.   for(size_t i=0;i<data.size()-1; i++){.     cout << data[i] << endl;.   }. . . The result:. . 6789. . (Supposed to be a 10 at the end there)|161|0|active|i < data.size()If a vector has 5 elements, ‘i’ should become 4 to get the last element.||0
l7o9l81msl252d|out of bounds|I belive I defined everything correctly in my loop: there are 5 elements and I stopped short of the upper bound, but for whatever reason the compiler is still complaning about there being an index 5? I don't get how that index 5 came about.. . Also, the 100th percentile cout isn't displaying at all for some reason. This only happened in the undefined behaviors check, not in the general public test.. . uniqname: runy. . |214|1|active|@148||1
l7o8dmuded81qo|Debugging main() Function Issue|"Hello! Whenever I try to debug main(), it always says ""Exception has occurred \nAborted"". Is there any reason why this is happening?"|105|0|active|This is the default nature. Exception - aborted usually is indicating “assert(false);” was called. When you first open the project files, every function is defined as this, and calling any of the stats functions will immediately crash with this exception, as it hasn’t yet been coded.||1
l7o789m1gka69l|Stats Functions|I just wanted to ensure that were allowed to use functions within other functions. For example, in the mean function, we can use the sum function within our mean function. I just wanted to be better safe than sorry. |94|1|active|I believe there is no restriction on using our own functions inside our own functions. I mean, that’s kinda the point of functions||0
l7o6frn1hl131m|cannot step into function definition from stats_tests or main|whenever i use the debugger to step through my code and i go to the line where the function is being implemented to step into the function, instead of taking me to the function so i can step through the function, it takes me to some debugging vector file. what can i do about this?|83|0|active|Not quite sure about this but I think you step into the std vector class? You might wanna try step over a few times to get to the line you want.||0
l7o5m7ejbzq2rt|cmath for pow|for the stdev, can we #inlcude <cmath> to use pow function ?|110|0|active|Yes. These are the libraries we can use||0
l7o53m0emov1k0|summarize() Function in stats.cpp|Hello! I just had a general question particularly about the summarize() function in stats.cpp.. . If the purpose of the summarize() function is to just print out the frequency of each element, why is the return type vector<vector<double>>? I feel as though I missed something major in the specs :(. Or maybe it's just up to me figure out :D.|168|0|active|Output vector should look like:{ {num, freq}, {num, freq}, …}||0
l7o44h5wzo76zp|warning compiler error in AG|. . would this be an error caused by my setup or code?. . Thank you!!|55|0|active|Don’t include p1_library.cpp. Include p1_library.h.||0
l7o37uie7p73c7|Main.cpp reads &#34;hello from main&#34; instead of asking for a file name|In the p1 specs, it says main is supposed to prompt the user for a file name to do the practice run/ example. Am I supposed to code this, Or was it provided to us? . . |107|0|active|If you open main.cpp, you’ll notice that it is currently programmed only to output “hello from main”. You are meant to program the prompts asking for the file and displaying the data.||0
l7nxs9dpyt53o0|debugging issues|Hi!. . I have implemented all three files, and when I tried to debug, but it keeps on saying that assertion failed - if I implemented everything (including the stats.cpp functions), that error shouldn't come up anymore, right? I don't think I implemented my sum() function incorrectly either... is there something wrong with my code or is it something with the program?. . Also I keep on getting kicked to this screen of what seems to be memory locations - is that supposed to happen? I read some previous posts and they said you can just navigate back to your .cpp files and continue debugging. . . Thanks!. . |91|0|active|Any assert statements you have in your code will halt the program if the code inside the assertion evaluates to false. At the beginning of the project, we had assert(false) statements in all functions. Make sure all of those are removed. If you have any other assertions in your code, make sure they are evaluating to true as well.||0
l7nw38ctxue1gf|&#34;make test&#34; error|"Hello, I've been trying to run the main.cpp with ""make test,"" and I got the message saying ""make: *** [test] Error 1"". Screen_Shot_2022-09-04_at_6.05.06_PM.png. . What does this error mean? Does it have to do with the percentile function where it does not print out the 100th percentile or the formatting issue with colons from the summarize function? . Here are the files for your reference: stats.cpp and main.cpp. . Thank you so much for your time and kind help!"|9|0|private|Since your code works correctly for parts of the make test command, you are most likely getting this error from the percentile function when you pass in 1.0 as the percent. This error would cause the make to not finish, which is why you get a make error. I would suggest looking at how your percentile function handles the bounds.||0
l7ntdbr481z6mu|How many points is project one out of?|We can see 9 points in the autograder but are there more points for style and/or private test cases?|143|1|active|There will be more points but I do not believe we can disclose the exact amount, sorry! I would definitely write some test cases just to make sure your functions work as expected.||0
l7nquycq3wemn|Unable to Debug Stats.cpp|"When I try to run the ""make stats.exe"" on Ubuntu WSL, it says I cannot make stats.exe. I even have it in launch.json. How can I step through the function definitions to find out what's wrong? "|187|0|active|stats.cpp contains the functions you’re implementing for this project, but to actually run the code, you’ll want to compile make stats_tests.exe, make stats_public_test.exe, or eventually main.exe (when you get to writing your main.cpp file!). Notice how these three files are the ones that have a int main() function, which tells the compiler where to begin executing code. stats.cpp is just a file to host your functions, so there’s actually nothing to “begin” running!. . If you’re curious about how these commands work, take a peek at your Makefile - you’ll notice that the three “makeable” files I mentioned above are listed out in our Makefile, hence why it works here.. ||1
l7nnmy221tl61z|Regarding autograder score|Hi! I submitted my files to the autograder and got 9/9, but there is an error in Run, Public Tests - Undefined Behavior Checks as the picture shows. I wonder whether my score will be deducted because of this. If so, how can I check what is wrong? Thank you!. . |9|0|private|It is undefined whether this will affect your final score, but it's a good indicator that something might be wrong. From looking at your submission, it looks like you are going out of bounds when indexing a vector somewhere (checking index 5 when the vector only holds 5 elements, remember that we index starting from 0!).. . I found this out from looking at the error output in the autograder, it should be there if you scroll down from the screenshot that you took.||0
l7nmseukn5o61r|nested for loop in mode()|I was looking at the stats.h file and it said that the mode() function should use a nested loop, how should I be doing that?|136|0|active|You don't have to use a nested loop, that's just a hint for one way to implement it.||0
l7nle8idfrb1y|ExceptionAbortion has occured|Hi! I am getting this error. Did I do anything wrong in the setup?. . Thank you!. . . |77|0|active|When assert() evaluates to False (as is shown here), it throws an exception, so I believe that is supposed to happen.||0
l7nkwzc97dsw3|VSCode Skipping Breakpoints (Looked at Setup FAQ)|Hi.. . I noticed that when I am debugging my stats_tests.cpp, one of the breakpoints I have placed is being moved to the next line, so I cannot step into the function to see what is wrong. I looked at the Setup FAQ and changed my 'launch.json' configuration and downloaded the CodeLLDB extension, but nothing has changed. Here is a screenshot of my launch.json:. . |89|0|active|It could be for a variety of reasons. This happened to me also and it was because I was either:1. Not complaining my code before I ran it or2. Placed the breakpoint while the debugger was still running. This can cause weird errors. If it’s not one of these reasons, I recommend going to office hours. ||1
l7nknjjdqot4hd|break and continue|Are we allowed to use break and continue?|83|0|active|Yes||0
l7nioefhwcz1p5|alignment of percentile output|Hello!. . I just finished programming my main.cpp driver function and was checking the output of my main.exe against main_test.out.correct when I noticed the percentile output is somehow aligned in a way different than just outputting the information. I'm new to C++ and am not really sure how to accomplish output alignment, could I get some guidance? My output is correct, but when compared to main_test.out.correct, the output is not the same because it is aligned differently. . . Thank you!|10|0|private|"Just add spaces before the percentile numbers as required to make the ""th""'s line up. As a hint, 100 should be all the way to the left, while 75 should have one space before it since it has 2 digits rather than 3."||0
l7nf47tw5sw65c|RME for percentile function|The rme for the percentile function states that the function should work as long as the vector is not empty, however from the formula it seems that it will be impossible to calculate the percentile if there is only one value in the vector since how will we find vk+1? Any help is appreciated, thank you!. |174|0|active|As I understand , just return the only value in the vector||1
l7nefns8hke47w|Difference in unit test &amp; system test.|I'm still a little bit confused about these two tests. . . According to the instruction, we are supposed to write all the tests in stats_tests.cpp right? However, according to the lecture, it seems that a unit test itself is a cpp file with a main function that tests just one function. Therefore, when I wrote test functions for each p1 function in tests_tests.cpp, this cpp file looks more like a system test. . . Therefore, are we supposed to create a cpp test file for each p1 function?|94|0|active|I’m not sure which lecture you’re referring to, but it was most likely an example with only one test being shown. You’ll want to write all of your tests as functions in the stats_tests.cpp file, and the main function in that file should call each test.||0
