post_id|subject|content|unique_views|good_question|visibility|i_answer|s_answer|num_followups
l8kguq9wflm4r5|Test case fails, says 42 != 42|Not sure what is happening. . |62|0|active|This looks like a white space issue. Make sure your spaces and new line characters are correct ||0
l8jn06w9a9c2za|Error in Terminal|. Hi, I've been getting this error for a while and not sure what to do. If someone could take a look below or perhaps take a look at my AG submission, that would be great. Thanks :). . |38|0|active|this error is telling you you're trying to write to undefined memory, and gives you some hints of where this may be happening: look at processing.cpp line 191 & 271, and resize.cpp line 69||0
l8c0lm1vczfzm|Project 1 private tests|Hi,. . Just a piece of feedback to the course as a student. The general point of assignments, (exams, projects, HW, etc.) is to test my learning and see where I'm lacking so that I can improve. If I did something wrong, I want to understand why it is wrong and what I should've done instead. In the case of private tests, I just know that I did something wrong. Not why or how it was wrong. Without this information, I'm not sure how to improve and not make the same mistake in the future.. . I get that it's policy that's been in place for years, but I feel like it's counterintuitive to be unable to learn from my mistakes. Also, I am not just mad or angry about P1, I only lost 1 point in the private tests which I am perfectly fine with. I just felt like sharing my thoughts because it is frustrating to know that I am wrong and not know why, and I'm sure that I will experience the same feelings in the future. . . Thanks for your time. |5|0|private|Hi Sumer! I totally understand wanting to learn from your mistakes and continuously improve on your coding skills. We keep the private tests hidden so that they aren't shared with next semester's students which makes them not so private.. . You are allowed to come to office hours, specifically office hours with a professor and ask about why you lost points. Some staff members and most of the professors should be able to give you that information. So please come to office hours! You will definitely be able to get feedback!||0
l86qk6uyvqp2u|Version of Ubuntu|Hi,. . I installed Ubuntu 16.04 LTS, is it the latest version? I am not sure whether it is enough for doing our projects. I also installed Ubuntu 20.04, but I failed to set the password, so I cannot do some command on that version. . . Thank you so much!|43|0|active|Version 16.04 is enough for our projects!||0
l863yoleq8k36i|Grades for Project 1?|so sorry for asking but was just wondering, when do project 1 grades get posted on canvas?|107|0|active|"If you do not already know your grade, you can check on the autograder in the ""my submissions"" tab for P1. Otherwise, I am not sure when they will be posted on canvas."||0
l83v2kgbzfs3lz|Autograder result|Hello! I just saw the results of my private tests, which turned out to be 20/24. I don't understand why simple functions such as sum and count failed. I would really appreciate it if I can get some insight on why there were such errors on the autograder.|20|0|private|I noticed you didn't have any test cases for sum() in your submitted code. Although it might seem like some functions are trivial, bugs can be very subtle and the only way to be sure they work as expected is to test them with a variety of input.. . I would recommend writing a few diverse test cases and see if you can replicated the bug on your end. As a hint, I believe your function will produce the correct output for a vector like {2,-1,0}. What are other types of values you can try passing in? Think about the data type being passed in.. . For count, you are missing an edge case. Hint: take a look at the RME for count. What is different compared to most of the other functions?. . Feel free to drop by office hours if you want to discuss writing thorough test cases.||1
l83pkg7n1z82fl|Private test failure for median|I'm not sure why but 2 of the private tests for the median failed on the autograder for my project but I can't find what's causing it since I am passing all of the tests I wrote that should cover all cases and those pass locally, so did I forget an edge case or something? Uniqname is bmcnulty|7|0|private|What happens if your input `v` is `{5, 2, 4}`?||1
l83e2oqat5otx|project 1 - summarize tests|Hi, on my end the summarize function worked but on the autograder it failed both tests -- can someone please clarify what was wrong thru autograder? uniqname is ekahrem|107|0|active|"I believe you had some out-of-bounds errors, where you attempted to access an element within a vector at an invalid index. Always be careful and remember that indices are only valid in the range of 0 - (size - 1). If you would want some further clarification with this, feel free to come to office hours!. . (Kevin) Adding to Tyler's answer: it's possible that in your local environment, you had old data leftover that you were ""successfully"" able to index into. The autograder basically cleans and resets memory so that everyone's tests are evaluated in the same conditions, which could be why it worked locally but not on autograder. For future reference, this is what CAEN is for - CAEN has the same environment as the autograder and will help you catch issues like this."||0
l82drwocie20z|When do we get out grades back on Project 1?|I'm curious as to when we will receive our project 1 grades on canvas.. . Also, do we ever get to see the outputs of the private test cases? I'm just asking because I'd like to know where I went wrong so that I can do better in the future.|182|2|active|Grades will be release Soon™️. You will get feedback on whether you passed the private tests or not, but to get feedback on what you may have missed, you should go to Professor Office hours. (Staff office hours may be able to help, but they don't know the details of what's covered for each test).||0
l829f9ubjkh32f|Autograder Error|I'm getting this error in the autograder and I don't know what it means.. Screen_Shot_2022-09-14_at_7.32.58_PM.png. Screen_Shot_2022-09-14_at_7.29.57_PM.png |117|0|active|It means that your are accessing an element that is outside of a vector.||0
l828v5rh6j42wb|About summarize|My summarize function can't print the last pair of data( i mean the number and it's corresponding frequency), and for the first pair of data, the frequency will automatically adding 1 itself.....|9|0|private|- My summarize function can't print the last pair of data. . The last element is not being pushed to the vector.. . - for the first pair of data, the frequency will automatically adding 1 itself. . You initialize count to 1 and begin the for loop at the first element. So you basically compare the first element with itself so `count` will always be incremented by 1 at the beginning.. . I strongly recommend you use the debugger to go through your code.||0
l828ciyuscw1bo|output not showing up in public tests|hi, in other outputs, almost everything is printing normally, but in the public tests, it just stops printing. im not sure why -- i attached a screenshot|79|0|active|Could you please add your uniquename on Piazza @6. It would be much helpful for us to help you if we can look at your code.. . What is the error? There will be an error output below that shows you what the error is. The error occurs in your `mode` function.||0
l827tne5anubt|cout in main|I successfully printed out the summarize function but nothing after that will print, this is my code. Is there something I'm doing wrong|7|0|private|Is there any error showing up? Could you provide the screenshot of the output?||0
l827npp12t65p4|Percentile Function|For the percentile function, should we assume that all the private tests will follow the REM in which P would be of an inclusive value between 0 and 1? Or do we have to check this case? |88|0|active|You don't have to check this case. You can assume the private test case inputs will always follow the RMEs listed in the header files.||0
l8272igdrk13yo|rounding|do we need to code anything that rounds the decimals ?|72|0|active|No.||0
l826crbxx7358i|Passing HCMST, but still failing UB checks in autograder|I get this result (the same result I've always been getting) in autograder even after I revamped my code and succeeded in the HCMST test. My code runs every type of test I put in, including tests with repeating numbers, etc. I can't figure out what part of my summarize function is causing this (I've messed with the for loops). . . Edit: apparently the UB checks don't really matter (?) but it's for my sanity and knowledge. Could someone check my code?|85|0|active|Double check that the bounds on your loops are correct in the summarize function (specifically, I would take a look at your inner loop that counts repeating numbers). The output is telling you that you are indexing out of the bounds of the vector.||0
l826bojjpzy1r6|percentile - overindexing and starting from index 0|Hi, what specifically in the percentile formula is causing it to index from 1? Is it the +1 in rank? I am trying to figure out how to avoid overindexing. thanks!|66|0|active|These posts should help you with this: @523 @519. . The reason why you have to deal with overindexing is because the formula uses the value of k+1 (consider whether there is an input that will yield a value k that lets you go out-of-bounds).||0
l826bnuyynz5um|Tests functions but not called in main function in stats_tests.cpp|Would we lose/not get points if we made a  bunch of tests for each stats method, but did not run tests for one of the functions? . . Specifically, in my main function in stats_tests.cpp, I did not run median tests. But, my median test works when I do run it(I just don't have that code to autograder.). . But, I have the median tests created just not tested(did not run function) in stats_tests.cpp main function. . . . Thank you!. |59|0|active|We only grade for the presence of test cases for this project, so you won't lose any points for this.||0
l825vfvr6y315k|office hours issue|hi, i was having issues with my laptop when i popped off the queue and had to restart it -- i was waiting for a couple hours, is there any way I could be pinned?|71|0|active|Marking as resolved.||1
l8244rw7u3o61e|Project 01 Problem|. . . My uniqname is simonxyw and my zoom meeting link is https://umich.zoom.us/j/2336634194 I didn't find anywhere to update my Piazza name. Could you please help me check it?. . |21|0|private|This is hard to help you with without us being able to see the entire feedback from the Autograder. Would you mind updating your Piazza name to include your uniqname? This will allow us to look up your Autograder submission. ||1
l8244fhq59l57m|out of bounds|I referenced @328 for the out of bounds error I'm getting, It is the same one as @455. but this is my percentile function and I am accounting for for extreme circumstances Im not sure what I'm doing wrong I've added my percentile function as well to reference- this is the only error I have left in my last submission if anyone can guide me in the right way please let me know! Thank you! . . double percentile(vector<double> v, double p) {.     assert(!v.empty());.     sort(v);.     double rank;.     double k = 0;.     double d = 0;.     double perc;.     rank = (p * (v.size() - 1)) + 1;.     k = modf(rank, &d);.     double a = v[d-1];.     double b = v[d];.     if (d == v.size()) {.         perc = v[v.size()-1];.     }.     else{.         double c = b - a;.         perc = a + k * (c);.     }.     return perc;. }|12|0|private|The index out of bounds error is going to happen anywhere that you're indexing into v. That means it's either happening where you're initializing a, initializing b, or initializing perc. Your error message should be able to tell you which line here is causing the index problem. ||1
l823m3lcdehn4|About using summarize|"I am quite confused about what is my summarize function doing, in last day's autograder, it shows my summarize prints output in a wrong format, without "":"" and the frequency, then I edited part of my code and try to get access to corresponding frequency of each value.. . So i have a 2d vector pairs, a 1d vector element,. . Element = {CurrentValue, Count};.             Pairs.push_back(Element);. . when i do the cout, how can i get the format: CurrentValue: Count ??? I tried something like . . for(j = 0; j < Pairs.size(); j++){.         cout << Pairs[j][0] << "":"" << "" "" << Pairs[1][j] << endl;.     }. . but it doesn't work."|104|0|active|And also i think my mode somehow will add one more count to what it should be, say the correct output is 6, mine is 7...||1
l823gjwgnfo5w0|Starting main|is this the right start for main.cpp im a little confused on how to start|10|0|private|That does seem fine to me. We want to have the user input a filename and some valid column within the file. Extract_column, as the p1_library states, should accomplish this task||1
l8222nqqkg0185|Redirect|Is the redirect portion of the main function required or can we leave it as taking the user's input for data and column?|62|0|active|The redirect portion is not required and is client side, so you won't get points off for not setting it up. It may be helpful to do so though since the autograder will be feeding data in that way, but there shouldn't be any big difference.||0
l821z4ek2zl3xp|Not sure what&#39;s going on in my main and stats|Okie guys something weird happens to me, my project passed the stats public tests in autograder but i don't know why in main the format of the out put is still wrong, i mean, in main.cpp i basically just call every function, if my stats.cpp is fine, why the format goes like this in main.cpp???? my mode is correct in stats public test but it's wrong in main.cpp???. . |93|0|active|"1. It seems like your main.cpp just doesn't print the information in the correct way. As you can see, line 5 should be ""6: 1"". And it looks like you aren't calling/printing the summary function correctly as you're missing the frequency for 10.. 2. It's certainly possible that your functions pass your unit tests as well as the public_test if these tests just aren't targeting what your function's weakness/error is. It's possible to pass the public tests but fail the main output here. You might just have to look closer at your mode function.. . For future formatting issues with autograder, it's helpful as well to click the show whitespace button so you can see exactly where spaces / newlines are missing."||0
l821wfkoi894or|make clean doesn&#39;t work, and failed to run on CAEN,|"My code works yesterday and before, but today while I was typing ""make clean"", the .exe files are not deleted, but ""make test"" works just fine, however, when I tried to run the code on CAEN, make test doesn't work, and it have the following error messages shown in the screenshot.. What should I do? Thank you!. . . "|21|0|private|This is actually kind of strange, what I would do is I would is:. . 1. Redownload the Makefile just incase you happened to accidentally make changes to it. 2. I would refer to this: https://eecs280staff.github.io/p1-stats/setup_caen.html#make-sync-shortcut . It's a shortcut you can add to your makefile so you can easily sync to caen by typing: make sync in your terminal. . . Sorry for the late response, but you can also try this for future projects!||0
l821k9h62xc4so|cout is ambiguous|I keep getting an error that says cout is ambiguous in my stats_tests.cpp. It puts squiggles under all of the couts in my test fuctions, does anyone know why this is? you can see on the right side the other places it is giving errors, there is 21 of them.|12|0|private|Could you post a screenshot of your include statements in stats_tests.cpp? ||1
l8215t00kfhmi|last line of percentile function|My 100th percentile line will not come up on the autograder, however it come up on the terminal when I run main _test_data. I have attached below: what the autograder said, my percentile function, and what the terminal read. |5|0|private|You're going out of bounds of your vector when calculating the 100th percentile. Walk through your code with p = 1 to see why this might be happening. You might need to add a special case to account for this issue.||0
l8210he5vt9pn|Is the auto grader supposed to take long?|Does the auto grader actually work on a queue like office hours? or is it just taking long for some other reason?|97|1|active|yes, it runs the projects like a queue! especially near the deadline, since many students are submitting their projects at once, it might take a bit longer||1
l820r03aiyv7nx|main.cpp public test|Hello . I submitted my main.cpp but it didn't pass the public test. I'm wondering what would be the error. Thank you.Screen_Shot_2022-09-14_at_3.28.36_PM.png|81|0|active|Looks like your spacing is off - you can use the show whitespace button at the bottom of the output to see the spaces - they will be shown as dots. You want all three percentile lines to end at the same place.||0
l820ke9eu7q3fz|Autograder Expected Output Incorrect?|. When I tried to solve this manually by hand, using the data set of <6, 7, 8, 9, 10>, I got a variance of 2, which means the standard deviation should be the sqrt of 2, which is 1.41421. Why should it be 1.58114?|80|0|active|You may be using the wrong standard deviation formula. The formula for p1 is. . $$\sqrt{\dfrac{\sum (x - \bar{x})^2}{N - 1}}$$. . where $$\bar{x}$$ is the mean, and $$x$$ is each value in the vector, and $$N$$ is the size of the vector.||1
l82057lyfyh1y1|Issue with summarize test function for loop|My for loop in test function for summarize isn't iterating through the inputted data vector.  My condition for the for loop looks good so I'm unsure what the issue is.Screen_Shot_2022-09-14_at_3.12.04_PM.png|10|0|private|Hmm, I think I might check the bounds of your for loop, it seems like you're not iterating through the final element because you put size -1?||0
l8203dceqx84tt|stats_tests.cpp having error compiling on autograder, compiles and runs perfectly fine in VSCode|I believe this is the same error as the error encountered in @380 and possibly @436, but I wanted to check to make sure so that I didn't waste a submit, and I had a couple questions about the error.. . I'm assuming that my problem is that I need to #include<cmath> in stats_tests.cpp, but in @436 the student answer recommends that the original poster #include<limits>. Do I need to do that too? If so, why?. . Also why is VSCode fine with me running stats_tests.cpp on it without cmath included but the autograder isn't?. . .  . . |77|0|active|yes add #include <cmath> to stats_tests.cpp -- as for the autograder question, vscode might be overlooking the fact cmath wasn't included and automatically recognizing the function but autograder does not. one way to check this is by running the project on CAEN, as it uses the same environment as autograder||0
l81zt5lf9q5he|Compilation Errors/Warnings for stats_tests.cpp|Hi,. When I submit my code to Autograder, I get warnings for compiling stats_tests.cpp and I am struggling on how to fix these.|5|0|private|Make sure to put . . #include <cmath>. at the top of your file. Right now, the autograder doesn't understand what abs you're talking about.||0
l81zrqcs1rx32|Autograder absolute value Error|I am having no compiling errors in VS code but the autograder is saying that my stats test are not compiling. Are we not allowed to use the absolute value function?|61|0|active|Did you put. ```cpp. #include . ```. at the start of your file?||1
l81zam2qp1k1y1|New summarize error|I fixed the error with random numbers, but now I'm getting 6:5 and not getting 10.  I know the data is just grabbing the size of the vector and putting it at 6, but why is 6 listed twice? How should I fix it?. new_sumerror.png. summaryfunct3.png|8|0|private|Can you post the rest of your summarize function? It might have something to do with what variables you're pushing into your vector.||1
l81yu6nmfpi5fr|Does Autograder test stats.cpp independently of main.cpp?|I wrote my functions in stats.cpp with the expectation that the vector input would always be sorted since I put sort(v); in main. This means my functions wouldn't work without main.|57|0|active|Your functions should be able to run independently from main, yes!||0
l81yocrztqm645|Didn&#39;t put UMID in my documents|I used up all my submissions but I didn't realize I had to put my UMID in because I added the class late (or maybe I missed it in the specs? didn't see it). Is there any way to submit again/Is it a big deal?|94|0|active|You are completely fine. We don't require your UMID in your files, it's just a recommendation.||0
l81yn8z6w8p56v|Percentile question|If I have a single element data set for example just 1, what should the 0th and 100th percentile values be? Will it be 1 or undefined? This is one of my edge cases.|5|0|private|It should be 1, for all percentile values.||0
l81y56rf9092y1|9/9 on autograder but orange main public test|Hi instructors - . . I got a 9/9 on the autograder but the main public tests are orange. They give me the points, and my output is exactly the same as what is expected, but I would just like to see if anybody could tell me if there's a specific function that's triggering it to be orange. I'm kind of betting it's my percentile function.. . Thanks!. . uniqname is wjrob|9|0|private|Your output looks great, but your program is exiting with code 1. This is because your main function in main.cpp is returning 1. As a convention, programs return an exit code of 0 if they run without error, and return a non-zero exit code if they encounter an error. So even though your program is running just fine, it's tricking the autograder into thinking there's an error by returning 1.. This has an easy fix: If your program makes it all the way to the end without error, it should return 0. Hope this helps!||0
l81wzze8ifl6z9|Trouble indexing out of bounds for summarize|I'm think my summarize function is ready to go except I'm getting an error message that I believe is saying im indexing out of bounds.  My loop seems to stop at the right stop though so I don't know what could be causing this.Screen_Shot_2022-09-14_at_1.37.05_PM.png|9|0|private|Say we have a vector with 5 elements: _ _ _ _ _. . The size here is 5. Since vectors are 0-indexed, we never want to access the element at index 5, because this would be going out of bounds: 0  1  2  3  4. . In your summarize function, do you see anywhere you might be trying to access the element past the end of the vector? (i.e. an element that does not exist?)||1
l81wz003jxs2wt|What does this error mean and how can I fix it so that I can run/debug my code|. . |24|0|private|Check on if launch.json is setup to run the .exe file of the file you are trying to run. The project instructions for what the .json is supposed to have shows you how to set it up for running the stats_tests.exe. If you are trying to run main then change that to main.exe.. . If that does not work then, click on debug anyway, if it takes you to another error that says that some filepath does not exist and there is a button to open launch.json then do the following:. . 1. click on that launch.json button so that you make sure it is trying to run the launch.json in the .vscode folder associated with the code. . 2. if that is the case then straight up delete the whole folder . 3. navigate to the .cpp file you are trying to debug/run and click on the arrow in the top right corner and click on debug. it may ask whether you are sure if you would like to do that or not due to launch.json not existing, just click ok . 4. make sure that it says the .exe for the file you are trying to run and that should work. . This maybe your issue if you have a mac with an M1 chip, I found that copying and pasting the .json setup that they want us to use from the instructions does not work. . . ||1
l81w0qgjvi33sz|AutoGrader|We have 3 graded submissions a day.. . . But, does that mean we can submit more than 3 times a day(just don't get feedback)--and the AutoGrader would grade the one with the most points?(even if it was past the 3 submissions a day?)|113|1|active|You cannot submit to the autograder more than 3 times, I tried.||0
l81vu6o3lxq588|My functions aren&#39;t looping until the end|Hello, my uniqname cristi. I'm not sure how to fix my percentile and mode functions so they iterate until the end of the vector.|11|0|private|In your mode function, it looks like you're making this comparison:. . if (v[i] < v[i + 2]) .... Your limits of i in your for loop are from 1 to v.size(). When i = v.size() - 2, this comparison becomes:. . if (v[v.size() - 2] < v[v.size()]) .... The index v.size() is out-of-bounds, so you get an error before the loop ends. You'll have to modify your code a bit to avoid this out-of-bounds indexing. . . . In your percentile function, I'm not sure what you mean when you say you're not iterating through the whole vector because I don't see any loops that iterate through the vector. Could you elaborate?||1
l81vmq2e2hk2u0|Issue with special case of 100th percentile|. I understand that we are supposed to have a special case for the 100th percentile due to indexing... otherwise my function has worked! I am confused as to where I should be adjusting my indexing in my code to properly attain the 100th percentile. I tried doing v.size-2 instead of v.size-1 but I keep getting errors. :/. |11|0|private|Let's think about what the 100th percentile is, in this case. If you take an exam, and your score is the 100th percentile, that means you scored the highest in the class, right? So now in the context of P1, what are you looking for when you print the 100th percentile in v?||0
