post_id|subject|content|unique_views|good_question|visibility|i_answer|s_answer|num_followups
l80t8ub5wpd1q6|Can we use cout for summarize as long as everything lines up?|Using C-out instead of vectors.|105|0|active|"You will need to use vectors in your summarize function implementation (in stats.cpp) as you have to return a vector of vectors and populate it with the summarizing data. In main.cpp, you will cout the data in this vector in the format of ""<value> : <frequency""."||0
l80sz9yt95ds5|Output in autograde not matching same auto grade in terminal|I have the correct output in my terminal output (which includes the 100th percentile). But for some reason, the output in auto grade doesn't show the 100th percentile and I'm not sure why this output is different. . 004D49AF-3D32-4B23-A387-37F74834F7C0_4_5005_c.jpeg. 3FDAFB91-FD62-485F-BECB-FB363622A14A.jpeg|123|0|active|Show white space. You are missing space in front of your outputs. My guess is that the first screenshot is from the correct output file - in other words, you didn’t make that one. Just add spaces manually to fix this problem :)Edit: also you are going to want a special case for the 100th percentile. Given my guess about the file you were viewing, I don’t think your main.cpp was producing something for 100th percentile.||1
l80sm35cxkv7hg|cout with summarize in main|"I've written the loops and when I run the practice example, I get .  I get that because at the end of the loops for my summarize function is , the vector is called joy.  I can't split it up doing cout << joy[i] << "": "" << joy[j] << endl; because it doesn't like that the cout << is only going to just joy[i].  How would I go on about fixing this?"|80|1|active|"Since you know that your inner vector only has two spots in it, you can skip the inner loop. Instead of what you have or:. . . cout << joy[i] << "": "" << joy[j] << endl;. you can double index without the for loop like:. . . cout << joy[i][0] << "": "" << joy[i][1] << endl;. . "||0
l80sbpv2bjo3q0|If, else statements|Is it possible to have an if statement with 2 elses underneath it?|48|0|active|You can only have one else statement in a conditional block, but you can handle as many conditions as you want using else if:. . if (my_first_boolean_expression) {.     .... } else if (my_second_boolean_expression) {.     .... } else {.     .... }||0
l80s2hseha36lr|error with my stats_test summarize function|I keep getting this erro, does this mean that my summarize function is not working? |61|0|active|Marking as resolved!||0
l80rsd2l5696qx|can someone please explain this error, not being able to figure it out||73|0|active|Hi, it looks like you could've copied some of these functions from stats.cpp into another file. A more probable case would be that you used #include stats.cpp in another file, try removing any instances of this and see how it goes.||0
l80qjatm78s2pw|cout statement not printing onto auto grader|"The 100th percentile doesn't print for the ""main public test (UB checks)"". What does this error mean and why does it stop the 100th percentile from being printed? . "|6|0|private|It means that you are indexing an element that is outside of a vector. This error occurs when p is equal to 1 in the `percentile` function.||0
l80o88bcs3t5bo|stdio not allowed|"Got my debugger to work for my main function, but it won't let me input the filename manually. I tried to add the ""stdio"" line listed for M1 Macs on the setup tutorial, but it still doesn't redirect."|92|0|active|Sorry we didn't get to this sooner! I'm actually not sure what the problem would be here. Feel free to come to office hours when something like this comes up again so we can get some more information :)||0
l80ns5l4bgb21v|comments|do we need comments at the top of each function saying the purpose. or do we need to write RME for anything|108|0|active|Comments aren't graded or necessary but they're useful for you as a developer (especially if you work with a partner in future projects).||0
l80nffhqf3n18u|stdev|when calculating stdev do we need to take absolute value from (each element - mean)|78|0|active|No you don't. You can go ahead and follow the wikipedia formula exactly which does not use absolute value ||0
l80mu5a010m5c2|no operator &#34; &lt;&lt;&#34; matches these operands|"Hello I am getting an error on one cout statement  where it says "". . I don't know why its happening , I remember having a similar error earlier but I resolved it.. . I am trying to index into the returned vector of vectors from my summarize statements?. . I am not sure what the error could be?"|16|0|private|the compiler does not know how to print mainsummarize[i] as this value is a vector not a double.I assume you are trying to print the values of the summarize vector. Instead of this method, think of how you can do it with a single for loop. Remember your vector of vectors will have i vectors and each vector will have two values. How can you leverage that information to print the summary? ||0
l80m9hjahg83p0|percentiles|is the percentile section in main always going to print 0, 25, 50, 75, and 100 (like the example in the spec)?|112|0|active|This is my understanding, yes. Our main function is the driver function which is meant to match the expected output. Our stats functions in stats.cpp are meant to be able to handle any data that we give them so long as it does not violate the requires clause.||0
l80m8q62t723dx|modf|Is this the correct way were supposed to be using modf and will it return the integer value into k and the decimal value in the d variables.. |7|0|private|you have to add an & ampersand vefore the k to make it a reference. This function will populate d with the decimal value and k with the int value of the input n ||0
l80lm7zunpf66z|Random number with summarize|As you can see in line 5, I keep getting this random number in my output when running summarize, and not getting the number 10. How do I solve this?. autogradererr.png|92|0|active|The student is correct, that junk value is likely the output of a variable that has not been initialized. Also be careful that you are not printing i in a loop (i is simply a value that increments) but rather the values within your actual result vector. It also looks like your output is giving you an out of range error. I would run your debugger and ensure that your summarize function returns the correct vector by looking in the side variables panel. If that is correct then you can step through how you are printing it and see why you are printing that junk value. . . . ||1
l80ju3up3402t9|epsilon rounding|I'm unsure on how the autograder will check private tests- for functions like sum or stdev, where the output could be a decimal value, how should I go about implementing floating number comparisons? I understand how the logic works, and can implement it in my own test program, but how do i know what this epsilon value that autograder uses will be? |165|0|active|I believe the epsilon value cited in the spec should be adequate for the autograder. So epsilon = 0.00001 should be fine!||1
l80jqp1128y3g6|autograder being weird regarding percentile|Hello, so my program outputs the correct numbers however the autograder is still not giving me the point for the main public test. The only difference I see in the expected output and the program output is the amount of whitespace around some of the outputs for percentile. Is that what is causing it and is this what they mean by the autograder will grade based on styling?. . Also does it matter that instead of having the formula calculate when it is given the 0th percentile and 100th percentile, I just have an if else if else where it outputs the largest number of the sorted vector for 100th, smallest for 0th and calculates it for all of the others?. . |170|0|active|If we provide you sample output, it can be helpful to compare your own output against our sample file on some sort of diff checker or using the handy diff command in your command line to easily see if there is any difference. . ||1
l80jp5p4zpa3lm|Code isn&#39;t responding how I think it should|Hello, I wrote the code for the percentile function, but it's not returning the value I believe it should return, I also pseudo coded it to make it easier to understand, could someone help? Thanks so much|13|0|private|Instead of lines where you are calculating the int (k) and decimal (d) values, I recommend using the modf function in the spec to avoid any issues with splitting the rank (n) value into its respective parts. . . Also, on the line where you are calculating percentile, remember that the formula given to us on Wikipedia operates on 1 indexing logic and we need to modify it to be 0 indexed. . . Lastly, I would take a look at the RME at what the p value should be. You're treating it as a whole number, but it specifies that the p value will be between 0 and 1 inclusive  ||1
l80j88yu3ne1r5|are we graded on style?|Where are the style guidelines if there are any?|124|0|active|"Style will not be graded on P1, but for later projects it'll be available on the public AG test cases. You can use ""make style"" to check your project if you'd like"||0
l80iok57m6j12c|multiple test cases per test function|It says in the spec that test cases should be written as separate test functions. Does that mean one test case per test function? Or can we put multiple test cases into a test function?|89|0|active|You can have more than one test case/assert statement per test function, this is moreso telling you to separate your mean/median/mode etc. tests into separate functions. However, I'd personally recommend not putting too many test cases in one function as it's cleaner to separate tests that are checking for different things. Also side note that tests are not explicitly graded for P1 (however are useful to make sure your code is working properly!)||0
l80hug0w8xzse|Variables wont update|. Hi ive been running this function in stats_tests.exe for a while now and no matter what i do my variables part2 and part3 wont update, part1 updates correctly to what its supposed to but the others stay at zero, any help would be greatly appreciated.|12|0|private|"Be careful about division in cpp. Using ""/"" for division will return only the integer portion, excluding all decimals. This can give you issues of returning 0 where you're not expecting it to. "||1
l80gloi3caa1z1|Way to avoid putting test vectors into each individual function?|Is there a place to put all the test vectors in Project 1 that work with each test function rather than having to put the vectors in each individual test function? Main.cpp didn't work. When I call vectors from main.cpp, it says undeclared identifier.|82|0|active|You could write a helper function that returns a specific vector. E.g.:. . . vector<double> get_special_vector() {.  return /* some vector */;. }. . although if you are using long enough vectors that reusing them is a pain, it might be worth rethinking your test cases. Remember that the small scope hypothesis says we should be able to expose any meaningful bug with a small test case (for this project, I don't think you should ever need more than 5 elements). Also remember that you can concisely initialize a vector using curly braces, e.g.:. . . vector<int> v = {1,2,3};||0
l80eykctpng1kp|Too many test cases|Is it possible to have too many test cases? I have 22 right now and want to make sure I won't be counted off for having too many. Thanks!|117|0|active|There is no max amount of test cases for this project and you will not lose points for having too many, as your test files are not submitted to the autograder (this time around). . . In fact, a comprehensive test suite is encouraged! Once you have tested all of the functions and thought of all the edge cases you can, feel free to cap your test suite.||0
l80eo4n7mws3ss|Debugging Main|"I've been attempting to use the debugger on main.cpp, however whenever I try to debug, a pop-up window appears. If I hit debug anyways,. . . Additionally, when I try to compile and run from the terminal, I get a long error message:. . I'm guessing it has something to do with ""Undefined symbol for architecture arm64"" since I'm running on a M1 Mac, but I have no idea.. . Edit: I've tried changing the launch.json from. . ""program"": ""${workspaceFolder}/stats_tests.exe"",. to . . . ""program"": ""${workspaceFolder}/main"", and. . . ""program"": ""${workspaceFolder}/main.exe"",. and neither of those have worked.. . . . . "|106|0|active|"1. Your debugger won't run if you have compile errors so that's the reason your debugger is throwing that popup. 2. In regards to your compile error, do you have #include ""stats.h"" and #include ""p1_library.h""? "||1
l80d43m71wc2oi|Runtime Error When Compiling Main|. . I haven't seen this error from anyone else on piazza, any idea why this might be occurring? I compile using make main.exe through my terminal, and when I do my main.cpp executes until it reads out the file name and the column, and then this runtime error occurs. Not sure why. |95|0|active|It says the error is in stats.cpp line 16, I would suggest looking there for some overflow of large numbers or indexing outside of some vector.||1
l80cevq4h6l72q|CAEN Not updating|"Hi, . . I tried to run ""make clean"", and restart CAEN, but each time I do it, the results of CAEN show a non-updated version of my code. How should I fix this? . Thanks. "|66|0|active|Resolved in follow ups||1
l80bvqhmk3s5pw|summarize function not iterating through the last element|Hey, so I'm trying to write my summarize function and it doesn't add the last element into my vector<double> (which then is added to the vector of vectors).. . startPos and EndPos helps determine the frequency of a number (both starts at 0, with endPos taking the value of j and startPos taking the value of j after the number and its frequency are added into the vector.. . . I've tried including an or operator in the if statement to check if endPos is equal to the size of vector v minus 1. It basically checks if endPos is the last index in vector v.. . When I try to debug it, at the last iteration (v.size() is 14, j is 13, endPos is 13, startPos is 11, and currentNum is 10), the program did go through the if statement, but it returned false and exited the for loop. Wouldn't the if statement be true because endPos is equal to v.size() - 1?. . Thank you.|11|0|private|"Try tracing through this example input: v = [1, 2, 2, 2]. After your code inserts the value:frequency pair for ""1"" into pairsInAVector, endPos is 1, currentNum is 2, and j is 1. Now, there is no other element in the vector that isn't 2, so (currentNum != v[j]) will never be true. Will (endPos  == (v.size() - 1)) ever be true, since you don't update endPos anywhere outside the if statement? Perhaps you should update that condition to check something other than endPos. Hope this helps!"||0
l80bjpc8obk5m|Command line tool download terminal|My terminal and compiler was working fine last night. Today I opened it up and navigated to my project file. I tried compiling my code and it prompted me to download command-line tool software that I already had. I did it anyways, and now everytime i try to run g++ command it asks me to download it again.|65|0|active|This might not be the for sure reason, but I believe they just released a software update for xcode command line stuff in system preferences. In case that's the issue.||1
l80bhulq1v730i|Project 1 Test Cases|Hi, I just have a very general question regarding projects. I know I am expected to be writing test cases of some sort to make sure my methods all work, but I'm not sure on how much testing I should go about doing (And where should I be implementing these, and how? Do I just type out multiple test scenarios?)How exactly is the grading done on testing? If my methods work out with not much testing done, would I still get full credit? |146|0|active|"A good tip is to make your test cases as succinct as possible, and to test ""edge"" cases (like passing in vectors of length one, etc). In the stats_tests.cpp file, you can write a bunch of functions each testing a different function in stats.cpp, and use one or more assert statements to check the output of your functions against what you expect the output to be. Once you also put function calls for your tests within main() in stats_tests.cpp, running ""make stats_tests.exe"" should compile and run your tests as well as the public tests provided."||1
l80bf420jq741e|Printing results of Summarize|Hi, . . The program asks us to print the results of summarize. I was wondering if it matters whether we print these results in the summarize() function or main.cpp?. . Thanks.|96|0|active|You should print in main||0
l80b35cv5gm65y|Autograder Spacing|. . I believe I am getting a spacing issue when submitting to the autograder, what does the dot before the 100 indicate in the last line?|101|0|active|The dots indicate spaces. If your output is the one on the right, the autograder is telling you that you have an extra space before you print 100.||1
l809iwh8j4b6ml|#include errors detected|What does this mean and how do I fix this? #include errors detected. Please update your includePath. Squiggles are disabled for this translation unit. . Screen_Shot_2022-09-13_at_10.00.06_AM.png|68|0|active|This can sometimes be resolved by closing vscode and reopening it remotely through wsl. If this doesn't work open up a followup discussion. ||0
l809iagh1bf5hu|Makefile command error|I get this error when I use the make commands to build my project. If I paste in the old fashion way everything works but it does not build/clean this way. Any help would be appreciated. |53|0|active|This issue can come up if there are extra spaces in a Makefile. Take a look at line 2 in your Makefile and ensure that there are no extra space characters in it. If the line is indented, make sure that it is indented with a tab and not spaces. . . If that does not resolve the issue, please upload a screenshot of your Makefile (around line 2) in the followups.||0
l8088hbpzv27p|Autograder - Public UB Checks &#34;blah&#34;|"Simple question I suppose... what is ""blah""?. "|115|0|active|The greyed out tests are private test cases so details won't be released. The way to pass these is to thoroughly test your code so you know it's working! Running your project on CAEN is also a good strategy.||1
l80741lvuci712|The AutoGrader is where I submit my Project 1, correct?|Just making sure, I submitted Project 1 to the autograder and it seems I pass all of the tests (except for the private ones, I don't know since I cannot see them). Does this mean I submitted Project 1 successfully? Or is there some other place to turn in Project 1 as well?|96|0|active|The autograder is the only place where you will need to submit Project 1, the private tests are released after the project deadline has passed.||1
l806rrivz4k6m3|Unable to open file|. . When trying to run my main program, I am getting this error, how would I fix a segmentation fault?|124|2|active|a segmentation fault means you are indexing out of bounds somewhere. You should start by stepping through with your debugger to see where your program faults. You can then examine that line for where you index out of bounds. It's likely the first function you call after reading in the column. Or it is within any code after where you called the extract columb function||1
l7zqrear61r1mo|error making stats.cpp file|Hi, I am trying to run the stats file with my code in it and i am getting this error:. No rule to make target `stats.exe'.  Stop.. I was able to make and run the main file, so I'm not sure whats wrong|65|0|active|check out piazza post @170||0
l7zql20cbsl3q1|CAEN not outputting correctly|When I put my code through the autograder it gets full points and when I run it normally through the terminal it pasts all the tests I put for it. But when I put my code through the CAEN option the only thing that is outputted is the original code (so main.exe prints out “this is main” etc.) and I’m not sure how to test it otherwise. I followed the CAEN tutorial again and recopied the files over, but I’m not sure if I made a mistake there.Should I be concerned about this/How do I make the CAEN output my updated code?|60|0|active|"That sounds like you probably aren't running the correct version of your code (the only reason running main.exe would print ""this is main"" is if you have a statement explicitly printing that in your code). Try running ""make clean"" on CAEN, and then run ""cat main.cpp"", which will print out that file. Is it the version you are expecting? If so, re-run ""make"" and try running again. If it's not the right version of the file, then we would need to see the output when you sync files over to see what's going wrong."||0
l7zqewyzb386xn|Main public test|I keep getting this error but my code works fine in the CAEN.. . I'm not sure whats wrong. |113|0|active|check out post @328 ||1
l7zq2fr4rgn3x3|Segmentation Error|I'm working through testing summarize and I'm trying to do a separate assert statement for each value with in the vector of a vector (looping as of now). However, I keep getting a segmentation error. I'm confused where this is coming from, I think it has something to do with how I'm calling the function. Is there a chance that you can check if that's the problem?. . Segmentation_Error_Screenshot.png. Note: size is a variable I created above|9|0|private|try stepping through with your debugger or  print your values from the result of your summarize function. It may not have the format you expect it to have and is segfaulting because it's not of the expected size that you had calculated. ||0
l7znfy8aovj37p|function within a function|Am I able to call a function from stats.cpp within stats.cpp, for example, mean(v) could be written as sum v/ count v?|9|0|private|yes! ||0
l7zndo02f6s2bh|zsh - permission denied|. . . I'm getting this error when trying to run my main file but not my test file? How would I access permission?|70|0|active|Try giving main.exe execution permission, as so:. chmod u+x ./main.exe. Then, try running main.exe again. Make sure you're typing out the whole executable name when you do this, as so:. ./main.exe. Let me know if this helps!||1
l7zm2qhyiii6z6|summarize|so the vector we return in summarize should have multiple rows of 2 values. How do u pushback to a double array to add a new row? right now all my elements are in row[0][i]... ect. i dont know how to add new elements to a new row.|131|0|active|You should have a vector:vector<double> temporary = {0,0};And you overwrite this each time in a for loop with your count and number. In each iteration of the for loop, push this temp vector back to the 2D vector.||1
l7zlckzwnqj5yf|summarize function|I'm confused on why my test cases is inputing the number and the frequency on different lines. I'm using Xcode and this is what the output looked like. I'm not sure if there's something wrong with my test case or the function itself.|133|0|active|This is an issue with where you're printing the result of your summary function. You are printing a new line after every element in your 2d vector which is not what you want to do ||0
l7zkyh3wnyy2gt|Error on autograder|All of my functions passed the tests, compiles, and runs perfectly in the terminal but when I put the files in the autograder, none of them seems to pass. Any help?|130|0|active|Also, try running your project in CAEN, as this will run your project in the same environment as autograder. Check out the CAEN tutorial for more information on how to do so: https://eecs280staff.github.io/p1-stats/setup_caen.html#prerequisites ||1
l7zkxjvzagu4s1|stdev returns the desired assertion value but the test still coredumps|Hello , I am unsure about the  rounding etiquette with stdev , but I am having another issue.. My stdev test returns the same value as  the value I am checking in the assert statement but I still get a core dump. I don't know what to do?. . stats.cpp :. . stats tests .cpp :. . command prompt:. |107|0|active|See @366 for how to compare doubles!||1
l7zkce7cnfa5bb|Linker Command Failed|. . When trying to compile my main.cpp, using make main.exe and ./main.exe, I am getting this error. I check to make sure that I included stats.h and p1_library.h in both my main.cpp and stats.cpp, I check other posts with similar errors and noticed in all of them there were issues with include statements within the various files, so not sure what else the problem could be?. |67|0|active|Did you check to see that you aren't #include-ing any .cpp files? They should only be .h.||0
l7zjjeoxq4e3u7|Variable wont reset|"In my mode function, when i try to reset the variable ""counter"" in my for loop, it doesn't reset. It's meant to reset every time the first for loop iterates. could i have some help"|9|0|private|"You're code looks reasonable. I would recommend running ""make clean"" and ""make"" and try debugging again. It's possible you are debugging an older version of code (that doesn't match up with the code you're seeing here). Also verify you're actually stepping into the ""else"" block."||0
l7zjh3q3rri67t|summarize|my summarize function return everything in row 0 but is it suppose to have different rows / does it need to?|115|0|active|The output of the summarize function should look like this:. ```cpp. vector> expected = {. 	{number, frequency},. 	{number, frequency},. 	{number, frequency},. 	.... }. ```. . where the `{number, frequency}` vectors are size 2. So it should have different rows, unless there is only one unique value in your input data.||1
